{"skill_id":"factory-requirement-grilling","version":"1.0.0","description":"通过逐轮澄清形成可审核的项目需求规格","source_ref":"factory:skills/factory-requirement-grilling/1.0.0","native_path":".opencode/skills/factory-requirement-grilling/SKILL.md","applicable_stages":["REQUIREMENT"],"load_mode":"NATIVE_ON_DEMAND","content_hash":"sha256:aaaaaaaaaaaaaaaaaaaaaaaaaaaaaaaaaaaaaaaaaaaaaaaaaaaaaaaaaaaaaaaa","status":"ACTIVE","published_by":"factory-release","published_at":"2026-08-06T10:00:00Z","created_at":"2026-08-06T10:00:00Z"}
